{
  "schema_version": "1.0.0",
  "payload_type": "gimbal_eo",
  "manufacturer": "Acme Optics",
  "model": "GB-EO-30",
  "serial": "GBEO30-2607-000142",
  "hw_rev": "revA",
  "manufacture_date": "2026-07-01",
  "fw_version": "2.3.1",
  "interface": "QR-S",
  "power": {
    "voltage_v": 12.0,
    "peak_current_a": 3.5,
    "avg_current_a": 1.8
  },
  "mass": {
    "mass_kg": 0.42,
    "cg_offset_m": [0.02, 0.0, -0.06]
  },
  "comms": {
    "dronecan_node_id": 40,
    "rtsp_stream": true
  },
  "eeprom": {
    "device_size_bytes": 512,
    "encoding": {
      "format": "cbor",
      "profile": "core-deterministic",
      "spec": "RFC 8949"
    },
    "header": {
      "magic": "DPD1",
      "layout_version": 1,
      "offset_bytes": 0
    },
    "regions": {
      "frozen": { "offset_bytes": 8, "length_bytes": 380 },
      "writable": { "offset_bytes": 388, "length_bytes": 120 },
      "writable_fields": ["/fw_version"]
    },
    "write_protect": {
      "mechanism": "both",
      "frozen_locked": true
    },
    "crc": {
      "algorithm": "CRC-32/ISO-HDLC",
      "parameters": {
        "width": 32,
        "poly": "0x04C11DB7",
        "init": "0xFFFFFFFF",
        "refin": true,
        "refout": true,
        "xorout": "0xFFFFFFFF",
        "check": "0xCBF43926"
      },
      "endianness": "little",
      "frozen_crc": "0x9B2F4C7A",
      "writable_crc": "0x1D0AE5B4"
    }
  }
}
